<?xml version="1.0" encoding="UTF-8"?>

<biblioteczka xmlns:xsi="http://www.w3.org/2001/XMLSchema-instance" xsi:noNamespaceSchemaLocation="2_2_schema.xsd">

  <ksiazka>
    <sygnatura>MS01</sygnatura>
    <autor>Tolkien, J. R. R.</autor>
    <tytul>Władca Pierścieni</tytul>
    <wydanie>2001</wydanie>
    <wydawnictwo>Zysk i S-ka</wydawnictwo>
    <isbn>8372981086</isbn>
    <opis>
    Książka opowiada o Wojnie o Pierścień, której wynik zależy od powodzenia misji niziołka Frodo Bagginsa. Hobbit musi zniszczyć tytułowy Pierścień, a dokonać tego może tylko w Mordorze, królestwie Saurona. W czasie jego wędrówki w Śródziemiu rozgrywają się liczne pojedynki, a ludzie, wspomagani przez czarodzieja Gandalfa, starają się stawić czoła cieniowi, który idzie od wschodu.
    </opis> 
  </ksiazka>
  
  <ksiazka>
    <sygnatura>MS02</sygnatura>
    <autor>Zafon, C. R.</autor>
    <tytul>Gra Anioła</tytul>
    <wydanie>2008</wydanie>
    <wydawnictwo>Warszawskie Wydawnictwo Literackie MUZA SA</wydawnictwo>
    <isbn>9788374956000</isbn>
    <opis>
    Młody, zdolny pisarz, otrzymuje wyjątkową ofertę napisania książki, która ma stać się nową religią. David Martin musi dowiedzieć się kim jest tajemniczy wydawca lecz na każdym kroku czyhają na niego niebezpieczeństwa. Zafon ponownie przenosi nas do Cmentarzyska Zapomnianych Książek znajdującego się w mrocznej Barcelonie lat dwudziestych XX w. W książce przyjaźń, miłość, talent i ambicja przeplaatają się z tajemnicą i grozą.
    </opis>
  </ksiazka>
  
  <ksiazka>
    <sygnatura>MS03</sygnatura>
    <autor>Christie, A.</autor>
    <tytul>I nie było już nikogo</tytul>
    <wydanie>2014</wydanie>
    <wydawnictwo>Wydawnictwo Dolnośląskie. Oddział Publicat</wydawnictwo>
    <isbn>9788327151797</isbn>
    <opis>
    Inny tytuł książki to "Dziesięciu Murzynków" lub "Dziesięciu Żołnierzyków". Dziesięć obcych sobie osób otrzymuje zaproszenie na odizolowaną od świata wyspę. W swoich pokojach znajdują fragmenty dziecięcego wierszyka, lecz tym razem dotyczy on ich losu. Kto jest odpowiedzialny za śmierć kolejnych osób? Czy ktokolwiek ocaleje z tej makabrycznej zabawy?
    </opis> 
  </ksiazka> 
  
</biblioteczka>